title,link,description,pubDate,source_id,country,category,language
Heroes Cup 2026: AS Kigali eye final berth ahead of APR clash,https://www.newtimes.co.rw/article/32866/sports/football/heroes-cup-2026-as-kigali-eye-final-berth-ahead-of-apr-clash,"Semifinals January 28APR FC vs AS Kigali (Kigali Pelé Stadium, 3:00 PM) January 29Rayon Sports FC vs Police FC (Kigali Pelé Stadium, 3:00 PM) AS Kigali captain Jan...",2026-01-26 15:20:31,newtimes,['rwanda'],['sports'],english
Tigers sign American guard Anthony Tarke,https://www.newtimes.co.rw/article/32865/sports/basketball/tigers-sign-american-guard-anthony-tarke,"Tigers Basketball Club have acquired American shooting guard Anthony Tarke on a season-long deal.The 28-year-old brings valuable experience from the NBA G League, where he prev...",2026-01-26 15:11:39,newtimes,['rwanda'],['sports'],english
Zouabi blames ‘weak domestic league’ for Rwanda’s early CAN Handball exit,https://www.newtimes.co.rw/article/32858/sports/handball/zouabi-blames-weak-domestic-league-for-rwandas-early-can-handball-exit,"Rwanda head coach Hafedh Zouabi has called for urgent improvements to the competitiveness of the domestic handball league, saying its current standard is holding back the national...",2026-01-26 04:44:13,newtimes,['rwanda'],['sports'],english
Eaden-Zack Harron: J60 Kigali winner dreams of winning grand slam,https://www.newtimes.co.rw/article/32857/sports/tennis/eaden-zack-harron-j60-kigali-winner-dreams-of-winning-grand-slam,"At 17, American tennis prodigy Eaden-Zack Harron is enjoying an inspiring journey that is already crossing continents.While Africa has been his most successful terrain in his ten...",2026-01-26 04:44:03,newtimes,['rwanda'],['sports'],english
Manchester United dent Arsenal title bid with dramatic win,https://www.newtimes.co.rw/article/32847/sports/football/manchester-united-dent-arsenal-title-bid-with-dramatic-win,Manchester United dealt a blow to Arsenal's Premier League title charge as Matheus Cunha's superb strike clinched a thrilling 3-2 win over the leaders on Sunday.Lisandr...,2026-01-25 19:12:06,newtimes,['rwanda'],['sports'],english
Bassane Set for Rayon return against Police FC,https://www.newtimes.co.rw/article/32845/sports/football/bassane-set-for-rayon-return-against-police-fc,Rayon Sports winger Aziz Bassane has confirmed he will be available for selection when the Blues face Police FC in the 2026 Heroes Cup semifinals at Kigali Pelé Stadium on January...,2026-01-25 18:55:19,newtimes,['rwanda'],['sports'],english
